[
  {
    "id": "OA-SRC-0001",
    "title": "The Application of Digital Twin Technology in the Development of Intelligent Aquaculture: Status and Opportunities",
    "publisher": "Fishes (MDPI)",
    "published_at": "2025",
    "accessed_at": "2026-08-26",
    "url": "https://www.mdpi.com/2410-3888/10/8/363",
    "doi": "10.3390/fishes10080363",
    "evidence_class": "scientific_report",
    "domain": ["digital_twin", "aquaculture", "real_time_monitoring"],
    "signal": "Reviews digital-twin use in intelligent aquaculture, including integration of environmental and biological observations.",
    "velyqua_relevance": "Supports studying a time-aware aquarium state model, but does not validate VELYQUA's consumer implementation or predictive advantage.",
    "limitations": ["Review-level evidence", "Aquaculture contexts may not transfer to home freshwater tanks"],
    "status": "active",
    "review_due_at": null,
    "related_opportunities": ["OA-OPP-004", "OA-OPP-010"]
  },
  {
    "id": "OA-SRC-0002",
    "title": "Redefining Aquaculture Safety with Artificial Intelligence: Design Innovations, Trends, and Future Perspectives",
    "publisher": "Fishes (MDPI)",
    "published_at": "2025",
    "accessed_at": "2026-08-26",
    "url": "https://www.mdpi.com/2410-3888/10/3/88",
    "doi": "10.3390/fishes10030088",
    "evidence_class": "scientific_report",
    "domain": ["ai_safety", "fish_health", "computer_vision"],
    "signal": "Maps AI-enabled fish behavior recognition and health-monitoring directions in aquaculture safety.",
    "velyqua_relevance": "Motivates future multimodal observation while reinforcing that safety claims require bounded evidence and human verification.",
    "limitations": ["Review/future-perspective scope", "Does not establish safe diagnosis for home aquariums"],
    "status": "active",
    "review_due_at": null,
    "related_opportunities": ["OA-OPP-006", "OA-OPP-012"]
  },
  {
    "id": "OA-SRC-0003",
    "title": "A Review on the Use of Computer Vision and Artificial Intelligence for Fish Recognition, Monitoring, and Management",
    "publisher": "Fishes (MDPI)",
    "published_at": "2022",
    "accessed_at": "2026-08-26",
    "url": "https://www.mdpi.com/2410-3888/7/6/335",
    "doi": "10.3390/fishes7060335",
    "evidence_class": "scientific_report",
    "domain": ["computer_vision", "fish_recognition", "monitoring"],
    "signal": "Surveys growing use of computer vision and AI for fish recognition, monitoring and management.",
    "velyqua_relevance": "Provides a landscape for future behavior/image experiments, not permission to diagnose disease or identify individuals in V0.",
    "limitations": ["Heterogeneous studies and datasets", "Image performance is sensitive to lighting, occlusion and water conditions"],
    "status": "active",
    "review_due_at": null,
    "related_opportunities": ["OA-OPP-006", "OA-OPP-007"]
  },
  {
    "id": "OA-SRC-0004",
    "title": "Advancing Fisheries Research and Management with Machine Learning: A Review",
    "publisher": "Fishes (MDPI)",
    "published_at": "2025",
    "accessed_at": "2026-08-26",
    "url": "https://www.mdpi.com/2410-3888/10/2/74",
    "doi": "10.3390/fishes10020074",
    "evidence_class": "scientific_report",
    "domain": ["machine_learning", "classification", "fisheries_management"],
    "signal": "Reviews machine-learning applications and their applicability to fish classification, detection and management.",
    "velyqua_relevance": "Useful for method selection and limitation tracking after VELYQUA has a dataset large enough to justify ML.",
    "limitations": ["Broad fisheries scope", "Method availability is not evidence of value in a single-tank small-data setting"],
    "status": "active",
    "review_due_at": null,
    "related_opportunities": ["OA-OPP-006", "OA-OPP-010"]
  },
  {
    "id": "OA-SRC-0005",
    "title": "Fine-Grained Fish Individual Recognition in Underwater Environments",
    "publisher": "Fishes (MDPI)",
    "published_at": "2025",
    "accessed_at": "2026-08-26",
    "url": "https://www.mdpi.com/2410-3888/10/3/102",
    "doi": "10.3390/fishes10030102",
    "evidence_class": "scientific_report",
    "domain": ["computer_vision", "individual_recognition", "underwater_imaging"],
    "signal": "Reports a computer-vision direction for fine-grained individual fish recognition under underwater conditions.",
    "velyqua_relevance": "Creates a future research option for individual baselines, subject to strong accuracy, welfare, privacy and product-value gates.",
    "limitations": ["Study context may not match diverse ornamental tanks", "VELYQUA explicitly excludes Fish Passport/ownership features"],
    "status": "active",
    "review_due_at": null,
    "related_opportunities": ["OA-OPP-007"]
  },
  {
    "id": "OA-SRC-0006",
    "title": "Predicting the Body Weight of Tilapia Fingerlings from Images Using Computer Vision",
    "publisher": "Fishes (MDPI)",
    "published_at": "2025",
    "accessed_at": "2026-08-26",
    "url": "https://www.mdpi.com/2410-3888/10/8/371",
    "doi": "10.3390/fishes10080371",
    "evidence_class": "scientific_report",
    "domain": ["computer_vision", "biomass", "growth"],
    "signal": "Reports image-based weight prediction for tilapia fingerlings in a defined study context.",
    "velyqua_relevance": "Signals that non-contact longitudinal measurements may be possible, but biomass estimation is not a V0 owner problem.",
    "limitations": ["Species- and setup-specific", "No evidence of transfer to mixed ornamental aquariums"],
    "status": "active",
    "review_due_at": null,
    "related_opportunities": ["OA-OPP-006"]
  },
  {
    "id": "OA-SRC-0007",
    "title": "Non-Linear Analyses of Fish Behaviours in Response to Environmental Stressors",
    "publisher": "Fishes (MDPI)",
    "published_at": "2023",
    "accessed_at": "2026-08-26",
    "url": "https://www.mdpi.com/2410-3888/8/6/311",
    "doi": "10.3390/fishes8060311",
    "evidence_class": "scientific_report",
    "domain": ["behavior", "environmental_stress", "biosensing"],
    "signal": "Examines fish behavior as an indirect response signal under environmental stressor conditions.",
    "velyqua_relevance": "Motivates behavior as corroborating evidence, never as a single-cause diagnosis.",
    "limitations": ["Indirect signal with multiple competing explanations", "Requires independently defined event labels"],
    "status": "active",
    "review_due_at": null,
    "related_opportunities": ["OA-OPP-006", "OA-OPP-012"]
  },
  {
    "id": "OA-SRC-0008",
    "title": "Shellfish as Biosensors in Online Monitoring of Aquatic Ecosystems",
    "publisher": "Fishes (MDPI)",
    "published_at": "2023",
    "accessed_at": "2026-08-26",
    "url": "https://www.mdpi.com/2410-3888/8/2/102",
    "doi": "10.3390/fishes8020102",
    "evidence_class": "scientific_report",
    "domain": ["biomonitoring", "behavior", "aquatic_ecosystems"],
    "signal": "Reviews biological organisms as online sentinels of aquatic environmental change.",
    "velyqua_relevance": "Broadens the long-horizon observability thesis beyond chemical probes while remaining outside current freshwater V0 scope.",
    "limitations": ["Shellfish-specific literature", "Not a direct consumer-aquarium implementation path"],
    "status": "active",
    "review_due_at": null,
    "related_opportunities": ["OA-OPP-005", "OA-OPP-011"]
  },
  {
    "id": "OA-SRC-0009",
    "title": "Smart Aquaculture Platform",
    "publisher": "OceanStar Technologies",
    "published_at": "2026",
    "accessed_at": "2026-08-26",
    "url": "https://oceanstartechnologies.ca/platform",
    "doi": null,
    "evidence_class": "commercial_claim",
    "domain": ["commercial_ras", "predictive_analytics", "automation"],
    "signal": "OceanStar publicly claims 30-second multi-parameter monitoring, cross-parameter ML, advance warning, reporting and rule-based equipment control for RAS facilities.",
    "velyqua_relevance": "Confirms a commercial RAS narrative adjacent to VELYQUA's research thesis, while targeting a different customer and safety envelope.",
    "limitations": ["Vendor-controlled claims", "No independent deployment, accuracy, customer or outcome evidence reviewed here", "Commercial RAS is not the home freshwater segment"],
    "status": "active",
    "review_due_at": "2026-11-24",
    "related_opportunities": ["OA-OPP-008", "OA-OPP-010", "OA-OPP-012"]
  },
  {
    "id": "OA-SRC-0010",
    "title": "Industrial-Grade Sensors for Aquaculture",
    "publisher": "OceanStar Technologies",
    "published_at": "2026",
    "accessed_at": "2026-08-26",
    "url": "https://oceanstartechnologies.ca/sensors",
    "doi": null,
    "evidence_class": "commercial_claim",
    "domain": ["commercial_ras", "sensors", "edge_hardware", "modbus"],
    "signal": "OceanStar publicly describes an ESP32-based hub, RS-485/Modbus sensors, Wi-Fi/LTE connectivity and relay outputs for industrial RAS.",
    "velyqua_relevance": "Provides an adjacent industrial reference for interfaces, provenance and reliability questions; it does not define V0 hardware requirements.",
    "limitations": ["Vendor specifications not independently verified", "Industrial price, power and maintenance envelope differs from home experiments"],
    "status": "active",
    "review_due_at": "2026-11-24",
    "related_opportunities": ["OA-OPP-005", "OA-OPP-008", "OA-OPP-009"]
  },
  {
    "id": "OA-SRC-0011",
    "title": "From Land-Based Farming to Offshore Marine Ranches: Digital-Twin Directions",
    "publisher": "Fishes (MDPI)",
    "published_at": "2026",
    "accessed_at": "2026-08-26",
    "url": "https://www.mdpi.com/2410-3888/11/3/134",
    "doi": "10.3390/fishes11030134",
    "evidence_class": "scientific_report",
    "domain": ["digital_twin", "marine_ranching", "system_simulation"],